{
  "active_opcode_count": 212,
  "call_adjacent_opcode_count": 59,
  "format_version": 1,
  "mir_contract_version": "1.7",
  "opcodes": [
    {
      "classification": "inherited",
      "deferred_wave": null,
      "mir_opcodes": [],
      "number": 0,
      "opcode": "ZEND_NOP",
      "proofs": [
        "source_cfg_complete",
        "reducible_cfg",
        "no_protected_regions",
        "branch_successor_order_exact",
        "phi_predecessor_order_exact",
        "edge_statepoints_complete",
        "no_calls",
        "no_reentry"
      ],
      "rationale": "Inherited unchanged from the live W04 profile.",
      "source_refs": [
        {
          "end_line": 8168,
          "path": "Zend/zend_vm_def.h",
          "start_line": 8162,
          "symbol": "ZEND_NOP"
        },
        {
          "end_line": 2729,
          "path": "ext/opcache/jit/zend_jit.c",
          "start_line": 2729,
          "symbol": "ZEND_NOP"
        }
      ],
      "w04_classification": "required",
      "w04_deferred_wave": null
    },
    {
      "classification": "inherited",
      "deferred_wave": null,
      "mir_opcodes": [
        "i64_add_no_overflow",
        "f64_add"
      ],
      "number": 1,
      "opcode": "ZEND_ADD",
      "proofs": [
        "source_cfg_complete",
        "reducible_cfg",
        "no_protected_regions",
        "branch_successor_order_exact",
        "phi_predecessor_order_exact",
        "edge_statepoints_complete",
        "no_calls",
        "no_reentry",
        "exact_scalar_types",
        "no_overflow",
        "no_destructor",
        "no_exception"
      ],
      "rationale": "Inherited unchanged from the live W04 profile.",
      "source_refs": [
        {
          "end_line": 45,
          "path": "Zend/zend_vm_def.h",
          "start_line": 25,
          "symbol": "zend_add_helper"
        },
        {
          "end_line": 83,
          "path": "Zend/zend_vm_def.h",
          "start_line": 46,
          "symbol": "ZEND_ADD"
        },
        {
          "end_line": 1712,
          "path": "ext/opcache/jit/zend_jit.c",
          "start_line": 1712,
          "symbol": "ZEND_ADD"
        },
        {
          "end_line": 4551,
          "path": "ext/opcache/jit/zend_jit_trace.c",
          "start_line": 4551,
          "symbol": "ZEND_ADD"
        }
      ],
      "w04_classification": "conditional",
      "w04_deferred_wave": null
    },
    {
      "classification": "inherited",
      "deferred_wave": null,
      "mir_opcodes": [
        "i64_sub_no_overflow",
        "f64_sub"
      ],
      "number": 2,
      "opcode": "ZEND_SUB",
      "proofs": [
        "source_cfg_complete",
        "reducible_cfg",
        "no_protected_regions",
        "branch_successor_order_exact",
        "phi_predecessor_order_exact",
        "edge_statepoints_complete",
        "no_calls",
        "no_reentry",
        "exact_scalar_types",
        "no_overflow",
        "no_destructor",
        "no_exception"
      ],
      "rationale": "Inherited unchanged from the live W04 profile.",
      "source_refs": [
        {
          "end_line": 104,
          "path": "Zend/zend_vm_def.h",
          "start_line": 84,
          "symbol": "zend_sub_helper"
        },
        {
          "end_line": 142,
          "path": "Zend/zend_vm_def.h",
          "start_line": 105,
          "symbol": "ZEND_SUB"
        },
        {
          "end_line": 1713,
          "path": "ext/opcache/jit/zend_jit.c",
          "start_line": 1713,
          "symbol": "ZEND_SUB"
        },
        {
          "end_line": 4552,
          "path": "ext/opcache/jit/zend_jit_trace.c",
          "start_line": 4552,
          "symbol": "ZEND_SUB"
        }
      ],
      "w04_classification": "conditional",
      "w04_deferred_wave": null
    },
    {
      "classification": "inherited",
      "deferred_wave": null,
      "mir_opcodes": [
        "i64_mul_no_overflow",
        "f64_mul"
      ],
      "number": 3,
      "opcode": "ZEND_MUL",
      "proofs": [
        "source_cfg_complete",
        "reducible_cfg",
        "no_protected_regions",
        "branch_successor_order_exact",
        "phi_predecessor_order_exact",
        "edge_statepoints_complete",
        "no_calls",
        "no_reentry",
        "exact_scalar_types",
        "no_overflow",
        "no_destructor",
        "no_exception"
      ],
      "rationale": "Inherited unchanged from the live W04 profile.",
      "source_refs": [
        {
          "end_line": 163,
          "path": "Zend/zend_vm_def.h",
          "start_line": 143,
          "symbol": "zend_mul_helper"
        },
        {
          "end_line": 204,
          "path": "Zend/zend_vm_def.h",
          "start_line": 164,
          "symbol": "ZEND_MUL"
        },
        {
          "end_line": 1714,
          "path": "ext/opcache/jit/zend_jit.c",
          "start_line": 1714,
          "symbol": "ZEND_MUL"
        },
        {
          "end_line": 4553,
          "path": "ext/opcache/jit/zend_jit_trace.c",
          "start_line": 4553,
          "symbol": "ZEND_MUL"
        }
      ],
      "w04_classification": "conditional",
      "w04_deferred_wave": null
    },
    {
      "classification": "deferred",
      "deferred_wave": "W06",
      "mir_opcodes": [],
      "number": 4,
      "opcode": "ZEND_DIV",
      "proofs": [],
      "rationale": "Inherited unchanged from the live W04 profile.",
      "source_refs": [
        {
          "end_line": 218,
          "path": "Zend/zend_vm_def.h",
          "start_line": 205,
          "symbol": "ZEND_DIV"
        },
        {
          "end_line": 1398,
          "path": "ext/opcache/jit/zend_jit.c",
          "start_line": 1398,
          "symbol": "ZEND_DIV"
        }
      ],
      "w04_classification": "deferred",
      "w04_deferred_wave": "W06"
    },
    {
      "classification": "inherited",
      "deferred_wave": null,
      "mir_opcodes": [
        "i64_mod_nonzero"
      ],
      "number": 5,
      "opcode": "ZEND_MOD",
      "proofs": [
        "source_cfg_complete",
        "reducible_cfg",
        "no_protected_regions",
        "branch_successor_order_exact",
        "phi_predecessor_order_exact",
        "edge_statepoints_complete",
        "no_calls",
        "no_reentry",
        "exact_scalar_types",
        "nonzero_divisor",
        "no_overflow",
        "no_exception"
      ],
      "rationale": "Inherited unchanged from the live W04 profile.",
      "source_refs": [
        {
          "end_line": 228,
          "path": "Zend/zend_vm_def.h",
          "start_line": 219,
          "symbol": "zend_mod_by_zero_helper"
        },
        {
          "end_line": 249,
          "path": "Zend/zend_vm_def.h",
          "start_line": 229,
          "symbol": "zend_mod_helper"
        },
        {
          "end_line": 276,
          "path": "Zend/zend_vm_def.h",
          "start_line": 250,
          "symbol": "ZEND_MOD"
        },
        {
          "end_line": 1668,
          "path": "ext/opcache/jit/zend_jit.c",
          "start_line": 1668,
          "symbol": "ZEND_MOD"
        },
        {
          "end_line": 4517,
          "path": "ext/opcache/jit/zend_jit_trace.c",
          "start_line": 4517,
          "symbol": "ZEND_MOD"
        }
      ],
      "w04_classification": "conditional",
      "w04_deferred_wave": null
    },
    {
      "classification": "inherited",
      "deferred_wave": null,
      "mir_opcodes": [
        "i64_shl_checked"
      ],
      "number": 6,
      "opcode": "ZEND_SL",
      "proofs": [
        "source_cfg_complete",
        "reducible_cfg",
        "no_protected_regions",
        "branch_successor_order_exact",
        "phi_predecessor_order_exact",
        "edge_statepoints_complete",
        "no_calls",
        "no_reentry",
        "exact_scalar_types",
        "valid_shift_count",
        "no_overflow"
      ],
      "rationale": "Inherited unchanged from the live W04 profile.",
      "source_refs": [
        {
          "end_line": 297,
          "path": "Zend/zend_vm_def.h",
          "start_line": 277,
          "symbol": "zend_shift_left_helper"
        },
        {
          "end_line": 318,
          "path": "Zend/zend_vm_def.h",
          "start_line": 298,
          "symbol": "ZEND_SL"
        },
        {
          "end_line": 1666,
          "path": "ext/opcache/jit/zend_jit.c",
          "start_line": 1666,
          "symbol": "ZEND_SL"
        },
        {
          "end_line": 4515,
          "path": "ext/opcache/jit/zend_jit_trace.c",
          "start_line": 4515,
          "symbol": "ZEND_SL"
        }
      ],
      "w04_classification": "conditional",
      "w04_deferred_wave": null
    },
    {
      "classification": "inherited",
      "deferred_wave": null,
      "mir_opcodes": [
        "i64_shr_checked"
      ],
      "number": 7,
      "opcode": "ZEND_SR",
      "proofs": [
        "source_cfg_complete",
        "reducible_cfg",
        "no_protected_regions",
        "branch_successor_order_exact",
        "phi_predecessor_order_exact",
        "edge_statepoints_complete",
        "no_calls",
        "no_reentry",
        "exact_scalar_types",
        "valid_shift_count"
      ],
      "rationale": "Inherited unchanged from the live W04 profile.",
      "source_refs": [
        {
          "end_line": 339,
          "path": "Zend/zend_vm_def.h",
          "start_line": 319,
          "symbol": "zend_shift_right_helper"
        },
        {
          "end_line": 358,
          "path": "Zend/zend_vm_def.h",
          "start_line": 340,
          "symbol": "ZEND_SR"
        },
        {
          "end_line": 1667,
          "path": "ext/opcache/jit/zend_jit.c",
          "start_line": 1667,
          "symbol": "ZEND_SR"
        },
        {
          "end_line": 4516,
          "path": "ext/opcache/jit/zend_jit_trace.c",
          "start_line": 4516,
          "symbol": "ZEND_SR"
        }
      ],
      "w04_classification": "conditional",